[
  {
    "claim_id": "finance",
    "field": "asking_price",
    "value": 1000000,
    "status": "OBSERVED",
    "evidence_type": "SYNTHETIC",
    "source": {
      "type": "fixture",
      "ref": "fixture://finance",
      "locator": "value",
      "publisher": "finance",
      "evidence_type": "SYNTHETIC"
    },
    "observed_at": "2026-09-13T08:00:00Z",
    "retrieved_at": "2026-09-13T08:01:00Z",
    "transformation": null,
    "verification": null,
    "conflict_claim_ids": [],
    "confidence": null,
    "limitations": [
      "Illustrative synthetic fixture; not empirical evidence."
    ],
    "context": {
      "currency": "DKK",
      "asset_id": "demo",
      "price_basis": "asking",
      "as_of": "2026-09-13"
    }
  }
]
