[
  {
    "claim_id": "wardrobe",
    "field": "physical_location",
    "value": "Frederiksberg",
    "status": "OBSERVED",
    "evidence_type": "SYNTHETIC",
    "source": {
      "type": "fixture",
      "ref": "fixture://wardrobe",
      "locator": "value",
      "publisher": "wardrobe",
      "evidence_type": "SYNTHETIC"
    },
    "observed_at": "2026-09-13T08:00:00Z",
    "retrieved_at": "2026-09-13T08:01:00Z",
    "transformation": null,
    "verification": null,
    "conflict_claim_ids": [],
    "confidence": null,
    "limitations": [
      "Illustrative synthetic fixture; not empirical evidence."
    ],
    "context": {
      "item_id": "demo-shirt"
    }
  }
]
