[
  {
    "claim_id": "retailer-a",
    "field": "retail_price",
    "value": 300,
    "status": "OBSERVED",
    "evidence_type": "SYNTHETIC",
    "source": {
      "type": "fixture",
      "ref": "fixture://retailer-a",
      "locator": "value",
      "publisher": "retailer-a",
      "evidence_type": "SYNTHETIC"
    },
    "observed_at": "2026-09-13T08:00:00Z",
    "retrieved_at": "2026-09-13T08:01:00Z",
    "transformation": null,
    "verification": null,
    "conflict_claim_ids": [],
    "confidence": null,
    "limitations": [
      "Illustrative synthetic fixture; not empirical evidence."
    ],
    "context": {
      "wine_id": "demo-wine",
      "vintage": 2021,
      "currency": "DKK",
      "bottle_ml": 750,
      "in_stock": true
    }
  },
  {
    "claim_id": "retailer-b",
    "field": "retail_price",
    "value": 400,
    "status": "OBSERVED",
    "evidence_type": "SYNTHETIC",
    "source": {
      "type": "fixture",
      "ref": "fixture://retailer-b",
      "locator": "value",
      "publisher": "retailer-b",
      "evidence_type": "SYNTHETIC"
    },
    "observed_at": "2026-09-13T08:00:00Z",
    "retrieved_at": "2026-09-13T08:01:00Z",
    "transformation": null,
    "verification": null,
    "conflict_claim_ids": [],
    "confidence": null,
    "limitations": [
      "Illustrative synthetic fixture; not empirical evidence."
    ],
    "context": {
      "wine_id": "demo-wine",
      "vintage": 2021,
      "currency": "DKK",
      "bottle_ml": 750,
      "in_stock": true
    }
  },
  {
    "claim_id": "market-price",
    "field": "market_price",
    "value": 350.0,
    "status": "DERIVED",
    "evidence_type": "SYNTHETIC",
    "source": null,
    "observed_at": null,
    "retrieved_at": "2026-09-13T08:01:00Z",
    "transformation": {
      "method": "median_current_comparables",
      "version": "1",
      "input_claim_ids": [
        "retailer-a",
        "retailer-b"
      ]
    },
    "verification": null,
    "conflict_claim_ids": [],
    "confidence": null,
    "limitations": [
      "Illustrative synthetic fixture; not empirical evidence."
    ],
    "context": {
      "wine_id": "demo-wine",
      "vintage": 2021,
      "currency": "DKK",
      "bottle_ml": 750,
      "in_stock": true
    }
  }
]
